{
  "schema": "agentbase.source-query-corpus/v1",
  "version": "2026-08-16.9",
  "created_utc": "2026-08-16T08:49:12Z",
  "workspace_roles": {
    "agentbase": {
      "repository": "AgentBase",
      "commit": "73484ba4654f01f85c7e897eca48873e522218c3",
      "snapshot_scope": "listed-oracle-files",
      "note": "The experiment builder additionally freezes the declared workspace identity scope and dirty patch; the default scope is the complete repository. These file hashes only bind this corpus oracle."
    },
    "large-cpp": {
      "repository": "GptProjectTest",
      "commit": "267384eb91bed9615c821bdbc3414a4094c668c9",
      "snapshot_scope": "listed-oracle-files",
      "note": "The experiment builder additionally freezes the declared workspace identity scope and dirty patch; the default scope is the complete repository. These file hashes only bind this corpus oracle."
    }
  },
  "cases": [
    {
      "id": "agentbase-file-discovery-control",
      "workspace_role": "agentbase",
      "language": "filesystem",
      "prompt": "在当前仓库中找到 query-gateway.md。只返回它的仓库相对路径。",
      "answer_max_lines": 1,
      "answer_contract": {
        "required": ["唯一仓库相对路径"],
        "supporting": ["排除 ignored 与可重建输出后的唯一性"]
      },
      "oracle": {
        "kind": "unique-path",
        "path": "tools/srcq/docs/query-gateway.md",
        "sha256": "57d7b6203c6f9afb1b1aa88bf041c041284cc09933764d88aadf318349c948bb",
        "must_be_unique": true,
        "search_scope": "repository truth excluding ignored and rebuildable output"
      }
    },
    {
      "id": "agentbase-rg-policy-sources",
      "workspace_role": "agentbase",
      "language": "markdown",
      "prompt": "当前仓库中，哪些正式规则文件共同规定：已知文件正文直接有界读取，文件发现、文本和 AST 查询统一经 srcq，并在证据充分后停止？排除测试和验证脚本。只返回相对路径，并用一句话概括规则，答案不超过四行。",
      "answer_max_lines": 4,
      "answer_contract": {
        "required": ["两个正式来源的相对路径", "两者共同规则的一句话概括"],
        "supporting": ["测试、验证脚本和开发证据不属于正式来源"]
      },
      "oracle": {
        "kind": "source-relation",
        "sources": [
          {"path": "global/AGENTS.md", "sha256": "9704447c2c7da5b8651a50670aebac3d73f979b1f80ba7fcc9bf0913f44c96fd", "anchor_line": 88},
          {"path": "skills/source-query/SKILL.md", "sha256": "29a49d55cbd498d2c0327866af88df621184372d522bf96133a013d4aa8d11e2", "anchor_line": 16}
        ],
        "relation": "both formal sources route known-file bodies through bounded direct reads, file/text/AST queries through srcq, and stop after sufficient evidence",
        "excluded_roles": ["test", "validation", "development-evidence"]
      }
    },
    {
      "id": "agentbase-provider-observation",
      "workspace_role": "agentbase",
      "language": "typescript",
      "prompt": "定位 TypeScript 中 ProviderObservation interface 的唯一定义，并指出 document_symbols 成功响应通过哪个 DTO 泛型字段暴露它。返回相对文件、1-based 行号和字段名，答案不超过四行。",
      "answer_max_lines": 4,
      "answer_contract": {
        "required": ["ProviderObservation 唯一定义的相对路径与 1-based 行号", "Collection<T>.provider 字段名及其 1-based 行号"],
        "supporting": ["ToolOutputDataMap.document_symbols 映射位置与 Collection<DocumentSymbol> 类型", "完整 document_symbols 到 ProviderObservation 关系链"]
      },
      "oracle": {
        "kind": "definition-and-generic-relation",
        "source": {"path": "mcp/vscode-lsp-mcp/packages/protocol/src/dto.ts", "sha256": "e1d1918ff87e9bbf91c2bf3add816e8af69e34f6181e3c8467df8ade5c7a825c"},
        "definition": {"symbol": "ProviderObservation", "line": 310, "unique": true},
        "generic_field": {"owner": "Collection<T>", "field": "provider", "line": 307, "type": "ProviderObservation"},
        "mapping": {"owner": "ToolOutputDataMap", "field": "document_symbols", "line": 694, "type": "Collection<DocumentSymbol>"},
        "relation": "document_symbols returns Collection<DocumentSymbol>, whose provider field exposes ProviderObservation"
      }
    },
    {
      "id": "agentbase-srcq-containing-contract",
      "workspace_role": "agentbase",
      "language": "rust",
      "prompt": "定位 srcq 的 process containing 位置投影实现，并简述它使用的坐标边界、最小包含选择和源码失效处理。返回实现文件相对路径及三项结论，答案不超过六行。",
      "answer_max_lines": 6,
      "answer_contract": {
        "required": ["实现文件相对路径", "零基半开坐标边界", "保留全部并列最小包含节点", "源码指纹变化时拒绝复用"],
        "supporting": ["execute_containing 的完整定义范围和各结论证据行"]
      },
      "oracle": {
        "kind": "implementation-contract",
        "source": {"path": "tools/srcq/crates/srcq-cli/src/processor/location_projection.rs", "sha256": "601c91a5b07b5d42d0996d92abe19d9c8b8f84aca0c7ad5914e05d9882b32760"},
        "implementation": {"symbol": "execute_containing", "start_line": 106, "end_line": 188},
        "facts": [
          {"id": "coordinate", "value": "zero-based half-open ranges [start,end)", "evidence_lines": [68, 70]},
          {"id": "selection", "value": "retain every tied smallest containing node", "evidence_lines": [134, 142]},
          {"id": "staleness", "value": "reject reuse when current source fingerprint differs from the cached pre-execution fingerprint", "evidence_lines": [381, 395]}
        ]
      }
    },
    {
      "id": "ue-command-dispatch-submit",
      "workspace_role": "large-cpp",
      "language": "cpp",
      "prompt": "在正式生产源码中定位 FUeAgentCommandDispatch::Submit 的完整定义范围，并给出它返回的两个协议错误 code。返回相对文件、起止行和两个 code，答案不超过五行。",
      "answer_max_lines": 5,
      "answer_contract": {
        "required": ["正式生产源码相对路径", "1-based inclusive 起止行", "command_dispatch_handler_missing", "command_handler_result_identity_mismatch"],
        "supporting": ["该文件是绑定快照中的正式生产源码"]
      },
      "oracle": {
        "kind": "definition-range-and-members",
        "source": {"path": "Plugins/UeAgentInterface/Source/UeAgentInterface/Private/CommandEdge/UeAgentCommandDispatch.cpp", "sha256": "2ecd7495dd943072e72f82960b8faec6da473e3d5be451177699475b704c82c2"},
        "definition": {"symbol": "FUeAgentCommandDispatch::Submit", "start_line": 53, "end_line": 84, "range_semantics": "1-based inclusive"},
        "members": ["command_dispatch_handler_missing", "command_handler_result_identity_mismatch"],
        "source_role": "formal production source"
      }
    },
    {
      "id": "ue-hjson-isbarekey-occurrences",
      "workspace_role": "large-cpp",
      "language": "cpp",
      "prompt": "列出正式生产源码中 FUeAgentStructuredHjsonFormatter::IsBareKey 的定义和全部调用位置。只返回相对文件与 1-based 行号，并确认结果是否完整，答案不超过八行。",
      "answer_max_lines": 8,
      "answer_contract": {
        "required": ["正式生产源码相对路径", "定义的 1-based 行号", "全部调用的 1-based 行号", "绑定正式源码范围内的完整性声明"],
        "supporting": ["定义与调用之间的语义分类"]
      },
      "oracle": {
        "kind": "complete-occurrence-relation",
        "source": {"path": "Plugins/UeAgentInterface/Source/UeAgentInterface/Private/Utilities/UeAgentStructuredHjsonFormatter.cpp", "sha256": "914c67966a48015c8d556fc4d565c29a035a8f8b554a35910af2d5f978941de3"},
        "definition": {"symbol": "FUeAgentStructuredHjsonFormatter::IsBareKey", "line": 2655},
        "calls": [648, 868, 2037],
        "complete_within": "formal production source at the bound snapshot",
        "requires_completeness_statement": true
      }
    }
  ]
}
